11:07:36.540338 IP 172.18.0.1.43340 > 172.18.0.3.80: Flags [S], seq 684, win 64240, options [mss 1460,sackOK,TS val 2504524758 ecr 0,nop,wscale 7], length 011:07:36.540350 IP 172.18.0.1.43340 > 172.18.0.3.80: Flags [S], seq 3739593684, win 64240, options [mss 1460,sackOK,TS val 2504524758 ecr 0,nop,wscale 7], length 0
11:07:36.540370 IP 172.18.0.3.80 > 172.18.0.1.43340: Flags [S.], seq 729, ack 685, win 65160, options [mss 1460,sackOK,TS val 3940385537 ecr 2504524758,nop,wscale 7], length 011:07:36.540370 IP 172.18.0.3.80 > 172.18.0.1.43340: Flags [S.], seq 1687891729, ack 3739593685, win 65160, options [mss 1460,sackOK,TS val 3940385537 ecr 2504524758,nop,wscale 7], length 0
11:07:36.540390 IP 172.18.0.1.43340 > 172.18.0.3.80: Flags [.], ack 1, win 502, options [nop,nop,TS val 2504524758 ecr 3940385537], length 011:07:36.540392 IP 172.18.0.1.43340 > 172.18.0.3.80: Flags [.], ack 1, win 502, options [nop,nop,TS val 2504524758 ecr 3940385537], length 0

11:07:36.541064 IP 172.18.0.1.43340 > 172.18.0.3.80: Flags [P.], seq 1:75, ack 1, win 502, options [nop,nop,TS val 2504524759 ecr 3940385537], length 74: HTTP: GET / HTTP/1.111:07:36.541069 IP 172.18.0.1.43340 > 172.18.0.3.80: Flags [P.], seq 1:75, ack 1, win 502, options [nop,nop,TS val 2504524759 ecr 3940385537], length 74: HTTP: GET / HTTP/1.1
11:07:36.541078 IP 172.18.0.3.80 > 172.18.0.1.43340: Flags [.], ack 75, win 509, options [nop,nop,TS val 3940385538 ecr 2504524759], length 011:07:36.541078 IP 172.18.0.3.80 > 172.18.0.1.43340: Flags [.], ack 75, win 509, options [nop,nop,TS val 3940385538 ecr 2504524759], length 0
11:07:36.541170 IP 172.18.0.3.80 > 172.18.0.1.43340: Flags [P.], seq 1:239, ack 75, win 509, options [nop,nop,TS val 3940385538 ecr 2504524759], length 238: HTTP: HTTP/1.1 200 OK11:07:36.541170 IP 172.18.0.3.80 > 172.18.0.1.43340: Flags [P.], seq 1:239, ack 75, win 509, options [nop,nop,TS val 3940385538 ecr 2504524759], length 238: HTTP: HTTP/1.1 200 OK
11:07:36.541211 IP 172.18.0.3.80 > 172.18.0.1.43340: Flags [P.], seq 239:851, ack 75, win 509, options [nop,nop,TS val 3940385538 ecr 2504524759], length 612: HTTP11:07:36.541211 IP 172.18.0.3.80 > 172.18.0.1.43340: Flags [P.], seq 239:851, ack 75, win 509, options [nop,nop,TS val 3940385538 ecr 2504524759], length 612: HTTP

11:07:36.541834 IP 172.18.0.1.43340 > 172.18.0.3.80: Flags [.], ack 239, win 501, options [nop,nop,TS val 2504524760 ecr 3940385538], length 011:07:36.541838 IP 172.18.0.1.43340 > 172.18.0.3.80: Flags [.], ack 239, win 501, options [nop,nop,TS val 2504524760 ecr 3940385538], length 0
11:07:36.541966 IP 172.18.0.1.43340 > 172.18.0.3.80: Flags [.], ack 851, win 497, options [nop,nop,TS val 2504524760 ecr 3940385538], length 011:07:36.541975 IP 172.18.0.1.43340 > 172.18.0.3.80: Flags [.], ack 851, win 497, options [nop,nop,TS val 2504524760 ecr 3940385538], length 0

11:07:36.544461 IP 172.18.0.1.43340 > 172.18.0.3.80: Flags [F.], seq 75, ack 851, win 501, options [nop,nop,TS val 2504524762 ecr 3940385538], length 011:07:36.544466 IP 172.18.0.1.43340 > 172.18.0.3.80: Flags [F.], seq 75, ack 851, win 501, options [nop,nop,TS val 2504524762 ecr 3940385538], length 0
11:07:36.544489 IP 172.18.0.3.80 > 172.18.0.1.43340: Flags [F.], seq 851, ack 76, win 509, options [nop,nop,TS val 3940385541 ecr 2504524762], length 011:07:36.544489 IP 172.18.0.3.80 > 172.18.0.1.43340: Flags [F.], seq 851, ack 76, win 509, options [nop,nop,TS val 3940385541 ecr 2504524762], length 0
11:07:36.544501 IP 172.18.0.1.43340 > 172.18.0.3.80: Flags [.], ack 852, win 501, options [nop,nop,TS val 2504524762 ecr 3940385541], length 0

